tweet_link,created_at,text,retweet_count,reply_count,like_count,quote_count,impression_count,hashtags,mentions
https://twitter.com/FLEthiopia/status/1649145713375211545,2023-04-20T20:19:12.000Z,ለመላው የእስልምና እምነት ተከታዮች እንኳን ለዒድ አል ፈጥር በዓል በሰላም አደረሳችሁ! https://t.co/jYAjyyeMW6,180,109,1123,8,45168,,
https://twitter.com/FLEthiopia/status/1647571393834360833,2023-04-16T12:03:25.000Z,RT @PMEthiopia: Prime Minister Abiy Ahmed and First Lady Zinash Tayachew hosted the annual Easter meal at Unity Park for the elderly and in…,169,0,0,0,0,,PMEthiopia
https://twitter.com/FLEthiopia/status/1647287538174795777,2023-04-15T17:15:28.000Z,እንኳን ለኢየሱስ ክርስቶስ የትንሣኤ በዓል አደረሳችሁ!  መልካም በአል https://t.co/6d2RbZ0KXC,200,261,1457,15,49027,,
https://twitter.com/FLEthiopia/status/1633074156009865216,2023-03-07T11:56:34.000Z,"ቀዳማዊት እመቤት ዝናሽ ታያቸው በጅማ ከተማ በማሪየት ሆቴሎች ስር የሆነውን  የፎር ፓይንትስ ባይ ሸራተን ሆቴል ጅማ ፕሮጀክት የመሰረት ድንጋይ አስቀምጠዋል ። 
የፕሮጀክቱ ባለቤት ሜድሮክ ኢንቨስትመንት ግሩፕ ነው ። 120  ክፍሎች ይኖሩታል ፡፡ https://t.co/s90odbtsD2",55,29,268,4,17118,,
https://twitter.com/FLEthiopia/status/1633046976638906370,2023-03-07T10:08:34.000Z,ቀዳማዊት እመቤት ዝናሽ ታያቸው በቦንጋ ከተማ ያስገነቡትን 6ኛውን የዳቦና ዱቄት ፋብሪካ መርቀው ስራ አስጀምረዋል። በቀን 300 ሺ ዳቦና 420 ኩንታል ዱቄት ያመርታል  ከ150 በላይ ሰዎች የስራ እድል የፈጠረው  ፕሮጀክት ግንባታው 11 ወራትን ወስዷል። https://t.co/qVx5oZ9dHS,128,92,515,14,62128,,
https://twitter.com/FLEthiopia/status/1633034772623552512,2023-03-07T09:20:04.000Z,ቀዳማዊት እመቤት ዝናሽ ታያቸው የቦንጋ ቀላል አውሮፕላን ማረፊያ  ግንባታ የመሰረት ድንጋይ አስቀምጠዋል ።ፕሮጀክቱን የሚያከናውነው ሜድሮክ ኮንስትራክሽን ሲሆን በሁለት ዓመት ጊዜ የሚጠናቀቅ ይሆናል። https://t.co/YlxLi3PeS6,45,15,190,2,10529,,
https://twitter.com/FLEthiopia/status/1628381504245051392,2023-02-22T13:09:39.000Z,ቀዳማዊት እመቤት ዝናሽ ታያቸው በጎንደር ከተማ ያስገነቡትን ከ11ዱ የዳቦ ቤት ፕሮጀክቶች አምስተኛውን መረቁ::በቀን 300 ሺ ዳቦና 420 ኩንታል ዱቄት ያመርታል ፡፡ቀሪ 6 ዳቦ ቤቶች ግንባታ በመካሄድ ላይ ነው ፡፡ https://t.co/hhURGwZVeQ,168,145,750,20,106101,,
https://twitter.com/FLEthiopia/status/1627273661429284865,2023-02-19T11:47:28.000Z,"First Lady Zinash Tayachew Delivered The Opening Remark on 27th OFLAD General assembly On ""Closing Gaps and Empowering Women And communities"". https://t.co/mhJLuHQt3i",134,43,625,5,43575,,
https://twitter.com/FLEthiopia/status/1627239922909192194,2023-02-19T09:33:24.000Z,RT @OAFLAD: “We’re working towards global projects that are #ClosingGenderGaps and empowering women and communities. Let's continue to supp…,27,0,0,0,0,ClosingGenderGaps,OAFLAD
https://twitter.com/FLEthiopia/status/1626969275775721473,2023-02-18T15:37:57.000Z,First Lady Zinash Tayachew welcomed the First Ladies of African countries who had  come to Addis Ababa to attend the 27th Ordinary General Assembly of the Organization of African First Ladies for Development at the Grand Palace. https://t.co/MaQJeg6pNc,134,30,601,13,35379,,
https://twitter.com/FLEthiopia/status/1615015867246313475,2023-01-16T15:59:22.000Z,https://t.co/NdWfEwwy7X,4,15,25,0,4578,,
https://twitter.com/FLEthiopia/status/1615014441950527490,2023-01-16T15:53:43.000Z,https://t.co/NPJ8nG5E02,4,6,25,0,5940,,
https://twitter.com/FLEthiopia/status/1611647526871990272,2023-01-07T08:54:48.000Z,ጠቅላይ ሚኒስትር ዶ/ር ዐብይ አሕመድና ቀዳማዊት እመቤት ዝናሽ ታያቸው  የገና በአልን ምክንያት በማድረግ ለአረጋዊያን ለአካል ጉዳተኞች እና ጎዳና ተዳዳሪዎች ማዕድ አጋርተዋል:: https://t.co/sLIUTTbu8s,163,111,787,13,55608,,
https://twitter.com/FLEthiopia/status/1606575990708535298,2022-12-24T09:02:19.000Z,ቀዳማዊት እመቤት ዝናሽ ታያቸው ዶ/ር ዐቢይ አሕመድ በተገኙበት በሃዋሳ ከተማ ከ11ዱ የዳቦ ቤት ፕሮጀክቶች 3ኛውን መርቀዋል። የቀዳማዊት እመቤት ፅ/ቤት በለሚ ኩራ ክ/ከተማ በቀን 1 ሚሊየን ዳቦ የሚያመርት ግዙፍ ፋብሪካ ጨምሮ 4 ዳቦ ቤቶች  አስመርቋል https://t.co/ZbPdQsnQbC,116,55,409,7,28907,,
https://twitter.com/FLEthiopia/status/1606202249574641665,2022-12-23T08:17:12.000Z,ጠቅላይ ሚኒስትር ዶ/ር አብይ አህመድና ቀዳማዊት እመቤት ዝናሽ ታያቸው  የቀዳማዊት እመቤት  ፅ/ቤት ያስገነባውን 300ሺ ዳቦና 42 ቶን ዱቄት የሚያመርት  ከ11ዱ የዳቦ ቤት ፕሮጀክት 2ኛው ፋብሪካ በወላይታ ሶዶ ከተማ መርቀዋል ፡፡ https://t.co/OgsMlazAvD,145,54,552,5,34617,,
https://twitter.com/FLEthiopia/status/1587797414127480834,2022-11-02T13:22:58.000Z,"RT @PMEthiopia: PM @AbiyAhmedAli, First Lady Zinash Tayachew, the Speaker of the HOPR, Ato Tagese Chafo &amp; other senior government leadershi…",310,0,0,0,0,,"PMEthiopia,AbiyAhmedAli"
https://twitter.com/FLEthiopia/status/1584175562314043393,2022-10-23T13:31:01.000Z,RT @AbiyAhmedAli: I attended the inaugural ceremony of the bakery built by the Office of the First Lady in Agaro. The office's commitment t…,1706,0,0,0,0,,AbiyAhmedAli
https://twitter.com/FLEthiopia/status/1584116554312343554,2022-10-23T09:36:32.000Z,"ቀዳማዊት እመቤት ዝናሽ ታያቸው ፅ/ቤታቸዉ  ያስገነባውን 300 ሺ ዳቦና 42 ቶን ዱቄት የሚያመርት ፋብሪካ በአጋሮ ከተማ መረቁ
ግንባታው 7 ወራት ፈጅቷል ።
በ10 ከተሞች ተመሳሳይ አቅም ያላቸው ዳቦና ዱቄት ፋብሪካዎች እየተገነቡ በመሆኑ በቅርቡ ይመረቃሉ https://t.co/TFug5v93qJ",332,45,1003,8,0,,
https://twitter.com/FLEthiopia/status/1583736228222234624,2022-10-22T08:25:15.000Z,"ቀዳማዊት እመቤት ዝናሽ ታያቸው  በጅማ ዞን አኮ ወረዳ ያስገነቡትን 2ኛ ደረጃ ት/ቤት ጠቅላይ  ሚኒስትር ዶ/ር አብይ አህመድ በተገኙበት  መረቁ።
የቀዳማዊት እመቤት ፅህፈት ቤት በሁለተኛ ዙር ከገነባቸው 7 ትምህርት ቤቶች አንዱ ነው ዛሬ የተመረቀው። https://t.co/Mk2QAgeFW7",317,55,977,10,0,,
https://twitter.com/FLEthiopia/status/1581698240466268162,2022-10-16T17:27:01.000Z,ቀዳማዊት እመቤት ዝናሽ ታያቸው በጎንደር ከተማ የሚያስገነቡትን 300 000 ዳቦና 42 ቶን ዱቄት የሚያመርተውን ፋብሪካ የግንባታ ሂደትን ጎበኝተዋል።የቀዳማዊት እመቤት ፅ/ቤት በ11 ከተሞች ከሚያስገባው የዳቦና ዱቄት ፋብሪካ ዛሬ  የተጎበኘው አንዱ ነው። https://t.co/0FXURvoHT9,277,46,966,7,0,,
https://twitter.com/FLEthiopia/status/1568906823436013568,2022-09-11T10:18:30.000Z,"RT @PMEthiopia: In celebration of the Ethiopian New Year, Prime Minister Abiy Ahmed and First Lady Zinash Tayachew hosted pensioners and th…",593,0,0,0,0,,PMEthiopia
https://twitter.com/FLEthiopia/status/1568558466305777666,2022-09-10T11:14:15.000Z,#NewProfilePic https://t.co/WN4vGXRrew,204,115,1568,12,0,NewProfilePic,
https://twitter.com/FLEthiopia/status/1568556340116684803,2022-09-10T11:05:48.000Z,"ብርሃን የመኖሪያ መንደር-1 ተብሎ የተሰየመዉ በ800 ካ.ሜ ተገንቷል።  7 ባለ 2ና 13 ባለ 1 መኝታ አሉት ።ቀዳማዊት ዝናሽ ለ2014 ዋዜማ ማህበረሰቡን በጎበኙበት ወቅትና የአካባቢዉን የአኗኗር ሁኔታ ከተገነዘቡ በሗላ ነዉ ቤቶቹን ለመገንባት የወሰኑት
2/3 https://t.co/aNRJUJqBdK",54,15,213,1,0,,
https://twitter.com/FLEthiopia/status/1568556280251355137,2022-09-10T11:05:34.000Z,"ቀዳማዊት እመቤት ዝናሽ ታያቸዉ ዘነበ ወርቅ  በኮ/ቀ/ክ/ከ ዘውዴ ሜዳ አካባቢ በ75 ቀናት ያስገነቡትን 20 መኖሪያና 15 ሱቆችን አስረከቡ
በተለምዶ ቆሼ ተብሎ በሚጠራዉና ለስጋ ደዌ ተጠቂዎችና አቅመ ደካሞች ነዉ ቤቱን አስገንብተዉ ያስረከቡት
1/3 https://t.co/OUiUmEcjGR",160,30,610,4,0,,
https://twitter.com/FLEthiopia/status/1566142239327371264,2022-09-03T19:13:02.000Z,https://t.co/1RczfvGRbt,16,7,62,3,0,,
https://twitter.com/FLEthiopia/status/1566141959982518272,2022-09-03T19:11:55.000Z,"የኦርካም ማይ አይ ዘመናዊ መነጽር ከ1 አመት በፊት በ150 አይነስዉራን በፓይለት ፕሮጀክት ተሞክሮ ለአይነስዉራኑ እጅግ የጠቀመ ሆኖ በመገኘቱ አሁን 2000 ሰዎችን በሚጠቅም መልኩ አማርኛ እንዲያነብና የድምጽ ትእዛዝን እንዲቀበል ሆኖ ተሰርቷል
3/3",50,15,219,1,0,,
https://twitter.com/FLEthiopia/status/1566141954240421888,2022-09-03T19:11:54.000Z,"ከፊት ለፊት ምን እንዳለ እና ማን እንደመጣ መዝግቦ በመያዝ መረጃ ይሰጣል ፡፡ከለጋሾች በተገኘ ገንዘብ ወደ ሀገር ዉስጥ የገባዉ ኦርካም ማይ አይ የአይነስራኑን ህይወት የሚያቀልና የሰዉ እገዛ የሚቀንስላቸዉ ነዉ፡፡
2/3",52,4,228,2,0,,
https://twitter.com/FLEthiopia/status/1566141951015010305,2022-09-03T19:11:53.000Z,"የቀዳማዊ እመቤት ፅ/ቤት አይነስውራንን የሚረዳ የዘመኑ የቴክኖሎጂ ዉጤት የሆነ ኦርካም ማይ አይ የተሰኘ የማንበቢያ መነፅር ለ2000 አይነስውራን ሰጥቷል
መነጽሩ አማርኛም ሆነ እንግሊዝኛ ያነባል የገንዘብ ኖቶችን ይነግራል ቀለም ይለያል 
1/3 https://t.co/BSYyoIyZ1c",412,85,1407,16,0,,
https://twitter.com/FLEthiopia/status/1563966744426954753,2022-08-28T19:08:23.000Z,"RT @PMEthiopia: Prime Minister @AbiyAhmedAli and First Lady Zinash Tayachew, together with a Ministerial delegation, arrive in the North Af…",672,0,0,0,0,,"PMEthiopia,AbiyAhmedAli"
https://twitter.com/FLEthiopia/status/1555840827292893184,2022-08-06T08:58:54.000Z,"ፅ/ቤቱ ያስገነባው የልዪ ፍላጎት ት/ቤት በሀገራችን የአእምሮ እድገት ውስንነት ላለባቸው ታዳጊዎች የ2ኛ ደረጃ ት/ቤት እጥረትን በተወሰነ ደረጃ የሚቀርፍ ሲሆን ፕሮጀክቱ  ልዪ ፍላጎት ላላቸው ተማሪዎች አመቺ በሆነ መልኩ የተገነባ ነው 
2/2 https://t.co/60Zeh17XYM",35,25,199,1,0,,
https://twitter.com/FLEthiopia/status/1555840785077125123,2022-08-06T08:58:43.000Z,"የቀዳማዊት እመቤት ፅ/ቤት የገነባነውን የልዪ ፍላጎት 2ኛ ደረጃ ት/ቤት ቀዳማዊት እመቤት ዝናሽ መረቁ 
ለገጣፎ በሚገኘው ዲቦራ ፋውንዴሽን በ19 ሚሊየን ብርየተገነባው ት/ቤት የአይምሮ እድገት ውስንነት ላለባቸው ታዳጊዎች  አገልግሎት የሚሰጥ ነው 
1/2 https://t.co/tWKVhnaHZY",176,73,733,11,0,,
https://twitter.com/FLEthiopia/status/1538184333592240130,2022-06-18T15:38:17.000Z,"በ11 ሚሊየን  ብር ባጀትየተገነባው ትምህርት ቤት 12 የመማሪያ ክፍሎች የአስተዳደር ህንፃ፣ 2 ላብራቶሪ ፣ 1 ላይብራሪ እና 10 የመጸዳጃ ክፍሎችን ያሟላ ነው 
የቀዳማዊት እመቤት ፅ/ቤት የዛሬውን ጨምሮ 23 ሁለተኛ ደረጃ ትምህርት ቤቶችን አስመርቋል
2/2 https://t.co/HVNETLO8Y2",46,84,290,3,0,,
https://twitter.com/FLEthiopia/status/1538184317939204097,2022-06-18T15:38:14.000Z,"የሁለተኛው ዙር ትምህርት ቤት ምርቃት ቀጥሎ ቀዳማዊት እመቤት ዝናሽ ታያቸው በሲዳማ ክልል ኦዲ ቦኩ ከተማ  ያስገነቡትን ሁለተኛ ደረጃ  ትምህርት ቤት ሰኔ 11፣ 2014 ጠቅላይ ሚነስትር ዶ/ር አብይ አህመድ በተገኙበት መርቀዋል
1/2 https://t.co/4hP222gTUj",137,125,641,9,0,,
https://twitter.com/FLEthiopia/status/1538183104107626496,2022-06-18T15:33:24.000Z,RT @AbiyAhmedAli: Review of First Lady’s Hawassa bread factory currently under construction. https://t.co/ND45jNhsTM,559,0,0,0,0,,AbiyAhmedAli
https://twitter.com/FLEthiopia/status/1538182968405114884,2022-06-18T15:32:52.000Z,RT @AbiyAhmedAli: Glad to attend the inauguration of a secondary school built in Sidama Region through the First Lady’s office in the secon…,617,0,0,0,0,,AbiyAhmedAli
https://twitter.com/FLEthiopia/status/1537895788696653825,2022-06-17T20:31:43.000Z,"RT @AbiyAhmedAli: Together with First Lady Zinash Tayachew, we also reviewed in Welaita Sodo, progress of one of the ten bread factories be…",616,0,0,0,0,,AbiyAhmedAli
https://twitter.com/FLEthiopia/status/1537895542562250753,2022-06-17T20:30:44.000Z,RT @PMEthiopia: Prime Minister @AbiyAhmedAli and First Lady Zinash Tayachew together with high level federal and regional officials are vis…,98,0,0,0,0,,"PMEthiopia,AbiyAhmedAli"
https://twitter.com/FLEthiopia/status/1536639309704482819,2022-06-14T09:18:55.000Z,"ሁለተኛ ደረጃ  ትምህርት ቤቱ  2014 ዓ.ም ሳያልቅ ተመርቆ ለሚመጣው ዓመት ትምህርት መስጠት የሚጀምር ይሆናል

2/2 https://t.co/UpcfUBZ3bn",14,39,152,1,0,,
https://twitter.com/FLEthiopia/status/1536639275260862465,2022-06-14T09:18:47.000Z,"85 ከመቶ ግንባታው  በተጠናቀቀውና የቀዳማዊት እመቤት ፅ/ቤት በጅማ ዞን አኮ ከተማ በሚያስገነባው  ት/ቤት 5000 ችግኞች  ተተከሉ፡፡ የአካባቢው ነዋሪ መምህራንና ተማሪዎች በጋራ የፍራፍሬ ችግኞችን ሰኔ 6፣2014 ዓ.ም   ተክለዋል 
1/2 https://t.co/wQP9DgxU11",51,50,350,2,0,,
https://twitter.com/FLEthiopia/status/1535542939824406528,2022-06-11T08:42:20.000Z,"በ 10 ሚሊየን  ብር የተገነባው ት/ቤት  10 የመማሪያ ክፍሎች የአስተዳደር ህንፃ 2 ላብራቶሪ 1 ላይብራሪ ክሊኒክና የመፀዳጃ ቤቶችን ያሟላ ነው 
የቀዳማዊት እመቤት ፅ/ቤት በመጀመሪያ ዙር የተገነቡትንና  ዛሬ የተመረቀው  ጨምሮ  22 ት/ቤቶችን ገንብቷል https://t.co/cd5uPkJ7ro",64,49,377,7,0,,
https://twitter.com/FLEthiopia/status/1535542901991669762,2022-06-11T08:42:11.000Z,"በሁለተኛው ዙር ከተገነቡት ሁለተኛ ደረጃ ትምህርት ቤቶች  መካከል አንዱ የሆነው በጉራጌ  ዞን የተሰራው የረገ ኢያት  2ኛደረጃ ት/ቤትን ዛሬ ሰኔ 4፣2014 ዓ.ም ቀዳማዊት እመቤት ዝናሽ ታያቸው መርቀዋል
1/2 https://t.co/ctoppLDBOp",144,77,770,10,0,,
https://twitter.com/FLEthiopia/status/1533816060956254209,2022-06-06T14:20:20.000Z,"The home renovation works for impoverished community members will continue for additional beneficiaries after this pilot project is completed .
2/2 https://t.co/QKee8k2KFd",20,37,126,0,0,,
https://twitter.com/FLEthiopia/status/1533816043327692800,2022-06-06T14:20:16.000Z,"First Lady Zinash Tayachew launched home renovation works for leprosy vulnerable community members in Kolfe Keranio sub-city. The First Lady's Office is renovating six homes that will be completed before the rainy season. 
1/2 https://t.co/hpQnYtYNZb",167,125,675,18,0,,
https://twitter.com/FLEthiopia/status/1530206814821810176,2022-05-27T15:18:29.000Z,"RT @PMEthiopia: PM @AbiyAhmedAli and his delegation arrived in Malabo, Equatorial Guinea for the 15th Extraordinary African Union Humanitar…",100,0,0,0,0,,"PMEthiopia,AbiyAhmedAli"
https://twitter.com/FLEthiopia/status/1505814246931718149,2022-03-21T07:51:07.000Z,"RT @PMEthiopia: The region has currently developed 240K hectares for wheat, teff, barley &amp; has a potential of developing 1.2M ha. It has de…",43,0,0,0,0,,PMEthiopia
https://twitter.com/FLEthiopia/status/1505814193269792769,2022-03-21T07:50:55.000Z,"RT @PMEthiopia: PM @AbiyAhmedAli &amp; First Lady Zinash Tayachew together with the Presidents of the Amhara, Oromia &amp; South Region &amp; other hig…",67,0,0,0,0,,"PMEthiopia,AbiyAhmedAli"
https://twitter.com/FLEthiopia/status/1455182522757881858,2021-11-01T14:38:44.000Z,"ቀዳማዊት እመቤት ዝናሽ ታያቸው እያስገነቡ ያሉትን የአይነስውራን አዳሪ ት/ቤት ጎበኙ 
የቀዳማዊት እመቤት ጽ/ቤት በ400 ሚሊዮን ብር የሚያስገነባው ት/ቤት 320 አይነስውራንን ማስተናገድ የሚችል ሲሆን ለአይነስውራኑ በሚሆን መልኩ እየተገነባ ነው፡፡ https://t.co/Va0F2IAmGf",208,77,873,8,0,,
https://twitter.com/FLEthiopia/status/1450825131689918466,2021-10-20T14:04:01.000Z,የቀዳማዊት እመቤት ፅ/ቤት በጉራጌ ዞን አበሽጌ ወረዳ  ለተማሪዎች 2088 ጫማ እና 500  ቦርሳዎች ሰጠ:: ፅ/ቤቱ በአበሽጌ ወረዳ ማመዴ ቀበሌ ሁለተኛ ደረጃ ት/ቤት እየገነባ መሆኑ ይታወቃል https://t.co/kKAMTVmmzz,360,104,1353,12,0,,
https://twitter.com/FLEthiopia/status/1450435372983406600,2021-10-19T12:15:15.000Z,"የቀዳማዊት እመቤት ጽ/ቤት በ2ኛ ዙር የገነባዉን 2ኛ ደረጃ ት/ቤት አስመረቀ
 ጽ/ቤቱ  በምእራብ አርሲ ዞን ሮጲ ከተማ የኢፋ ሮጲ 2ኛ ደረጃ ት/ቤትን በ7 ወር አጠናቆ አስመርቋል።በዚህ አመት የሚጠናቀቁ ሌሎች 7 ት/ቤቶችንም በመገንባት ላይ ነው https://t.co/XA4izgEXsH",230,57,898,16,0,,
https://twitter.com/FLEthiopia/status/1449370884343537668,2021-10-16T13:45:21.000Z,"የቀዳማዊት እመቤት ፅ/ቤት በቀጣይ በ10 ከተሞች ለሚገነባው የዳቦና ዱቄት ፋብሪካ ግንባታ ሂደት ላይ ይገኛል በነዚህ ከተሞች የሚገነቡት ዳቦ ቤቶች እያንዳንዳቸው በቀን 400 ኩንታል ዱቄት የማምረትና 300,000 ዳቦ የመጋገር አቅም ይኖራቸዋል
3/3 https://t.co/leYqy4LFds",613,85,2052,12,0,,
https://twitter.com/FLEthiopia/status/1449365921404014592,2021-10-16T13:25:38.000Z,"217 ሚሊዮን ብር ወጭ የወጣበትና ለ450 ሰዎች የስራ እድል የሚፈጥረው የዳቦ ፋብሪካ በቀን 72 ቶን ዱቄትም ያመርታል
ቀዳማዊት እመቤት ዝናሽ ታያቸው የዳቦ ፋብሪካውን ለአዲስ አበባ ከንቲባ አዳነች አቤቤ አስረክበዋል
2/3 https://t.co/lYFORXHMda",520,63,1847,9,0,,
https://twitter.com/FLEthiopia/status/1449365880211656713,2021-10-16T13:25:28.000Z,"የቀዳማዊት እመቤት ጽ/ቤት ያስገነባውን የዳቦና ዱቄት ፋብሪካ አስመርቋል በአ.አ ከተማ ለሚ ኩራ ክፍለ ከተማ በ6000 ካሬ ሜትር ላይ የተገነባው  የዳቦ ፋብሪካ በቀን 1,000,000 ዳቦ የሚጋግር ነው 
 1/3 https://t.co/hakMkV7oXd",1248,295,3796,31,0,,
https://twitter.com/FLEthiopia/status/1449362145213390849,2021-10-16T13:10:37.000Z,"217 ሚሊዮን ብር ወጭ የወጣበትና ለ450 ሰዎች የስራ እድል የሚፈጥረው የዳቦ ፋብሪካ በቀን 72 ቶን ዱቄት ያመርታል የዳቦ ፋብሪካውን  ቀዳማዊት እመቤት ዝናሽ ታያቸው  ለአ.አ ከንቲባ አዳነች አቤቤ አስረክበዋል
2/2 https://t.co/Myltr68iwl",658,171,2178,13,0,,
https://twitter.com/FLEthiopia/status/1447997102118871040,2021-10-12T18:46:26.000Z,"ኦርካም ማይ አይ የተሰኘዉ መሳሪያ መጽኀፍትን ጋዜጣ ወይም መጽሄት የመንገድ ምልክቶችን ሞባይል እንዲሁም ስክሪን ላይ የተጻፉ ነገሮችን ያነባል በሱፐር ማርኬት ዉስጥ ተጠቃሚዉ በቀላሉ እንዲገበያይ ይረዳዋል በርካታ ሌሎች አገልግሎቶችን ይሰጣል
2/2 https://t.co/eAPF277ZHD",74,7,356,1,0,,
https://twitter.com/FLEthiopia/status/1447997079368908800,2021-10-12T18:46:20.000Z,"የቀዳማዊት እመቤት ጽ/ቤት ለ150 አይነስዉራን ኦርካም ማይ አይ የተሰኘ ዘመናዊ አጋዥ መሳሪያ ሰጠ
መሳሪያዉ በቀዳማዊት እመቤት ፅ/ቤት አማካኝነት ከእስራኤል ሀገር ከመጡ ባለሙያች  ጋር በመተባበር ለ150 አይነስዉራን  ከስልጠና ጋር ተሰጥቷል
1/2 https://t.co/oaDe86KwiY",612,106,2012,16,0,,
https://twitter.com/FLEthiopia/status/1447974568224870401,2021-10-12T17:16:53.000Z,"የቀዳማዊት እመቤት ጽ/ቤት እየሰራ ከሚገኝባቸዉ የትኩረት አቅጣጫዎች አንዱ አካል ጉዳተኞችን ማገዝ በመሆኑም ከዚህ ቀደም ጽ/ቤቱ ለአይነስውራን የተለያዩ ድጋፎችንሲያደርግ ቆይቷል ፡፡ድጋፉም ይቀጥላል፡፡
 3/3 https://t.co/lKzt4Us0pD",41,7,159,0,0,,
https://twitter.com/FLEthiopia/status/1447974551418195970,2021-10-12T17:16:49.000Z,"ኦርካም ሚየየ የተሰኘዉ መሳሪያ መጽኀፍትን ጋዜጣ ወይም መጽሄት የመንገድ ምልክቶችን ሞባይልና ስክሪን ላይ የተጻፉ ነገሮችን ያነባል በሱፐር ማርኬት ዉስጥ ተጠቃሚዉ በቀላሉ እንዲገበያይ ይረዳዋል በርካታ ሌሎች አገልግሎቶችን የሚሰጥ ነው 
2/3 https://t.co/gmegjgVHxX",30,4,146,0,0,,
https://twitter.com/FLEthiopia/status/1436583635507896320,2021-09-11T06:53:23.000Z,መልካም አዲስ አመት https://t.co/93IvqJFrWR,1197,258,5853,39,0,,
https://twitter.com/FLEthiopia/status/1436285574948835329,2021-09-10T11:09:00.000Z,"ቀዳማዊት እመቤት ዝናሽ  ለበአሉ በነፍስ ወከፍ ለ100 የስጋ ደዌ ተጠቂዎች 1000 ብር ድጋፍና የብርድ ልብስ ስጦታ አበርክተዋል፡፡አዲሱን አመት ስናከብር እረዳት የሌላቸዉ የተረሱ የማኅበረሰብ ክፍሎችን በማስታወስ ሊሆን ይገባል ብለዋል፡፡
2/2 https://t.co/PuqQjry6hY",122,15,501,5,0,,
https://twitter.com/FLEthiopia/status/1436285518665420801,2021-09-10T11:08:47.000Z,"ቀዳማዊት እመቤት  ዝናሽ ታያቸዉ በአዲስ አበባ አለርት ሆስፒታል  የስጋ ደዌ ተጠቂ የማህበረሰብ አባላት በብዛት በሚኖሩበት አካባቢ በመገኘት እንኳን አደረሳችሁ ብለዋል ፡፡
1/2 https://t.co/AvZ4kRmQuH",786,83,2210,12,0,,
https://twitter.com/FLEthiopia/status/1435992253063966720,2021-09-09T15:43:27.000Z,"ፋብሪካዉ የሚገነባባቸዉ ከተሞች ሰመራ ጅግጅጋ ሀረር ነቀምት ጎንደር ደሴ አሶሳ
ሀዋሳ ወላይታ ሶዶ ቦንጋ ናቸዉ፡፡
በአስሩም ከተሞች ሰርቶ ለማጠናቀቅ የ12 ወራት ጊዜና 800 ሚሊየን ብር ተመድቦለታል፡፡
2/2 https://t.co/vDbcy7XVJv",99,17,407,3,0,,
https://twitter.com/FLEthiopia/status/1435992243412865024,2021-09-09T15:43:24.000Z,"የቀዳማዊት እመቤት ጽ/ቤት እና ሚድሮክ ኢንቨስትመንት ግሩፕ በ 10 ከተሞች ለሚሰሩ የዳቦና ዱቄት ፋብሪካዎች ግንባታ የመግባቢያ ሰነድ ተፋራረሙ 
ፋብሪካዉ በቀን 400 ኩንታል ዱቄት የማምረት እና 300 000 ዳቦ የመጋገር አቅም ይኖረዋል 
1/2 https://t.co/5R1wa6arHg",578,75,1696,9,0,,
https://twitter.com/FLEthiopia/status/1429761102469021706,2021-08-23T11:03:05.000Z,"ከመደመር መፅሀፍ ገቢ ከሚገነቡት 8 የሁለተኛ ዙር የትምህርት ቤቶች ግንባታ ፕሮጀክት  መካከል የሆነው ይህ ትምህርት ቤት እስከ 2013 ዓ.ም መጨረሻ ሙሉ በሙሉ ተጠናቆ በ 2014 ዓ.ም የትምህርት ዘመን አገልግሎት የሚሰጥ ይሆናል ፡፡
2/2 https://t.co/IaeJwBZ9jg",61,9,331,0,0,,
https://twitter.com/FLEthiopia/status/1429761070554656770,2021-08-23T11:02:57.000Z,"በቀዳማዊት እመቤት ፅ/ቤት በምእራብ አርሲ ሮጲ ከተማ በመገንባት ላይ ያለው የሁለተኛ ደረጃ ትምህርት ቤት 90 ከመቶ ተጠናቋል፡፡ግንባታው ከተጀመረ 5 ወራት ተቆጥረዋል ፡፡
1/2 https://t.co/DLvCnbzVDx",202,33,863,5,0,,
https://twitter.com/FLEthiopia/status/1428406235498483720,2021-08-19T17:19:19.000Z,"ከ2ኛው ዙር ት/ቤቶች ግንባታ መካከል የሆነው በሎሬት ፀጋዬ ገ/መድህን የትውልድ ስፍራ ቦሩ ጎረምቲ ቀበሌ የሚገነባው  ይህ ት/ቤት ከመደመር  መፅሐፍ ገቢ ከሚሰሩት ከ 8ቱ አንዱ ነዉ፡፡
2/2 https://t.co/3LmNKn2EDX",50,8,326,1,0,,
